{"action_list":[{"action":"Publish schema freeze announcement","due_date":"Friday","owner":"Lin","status":"confirmed"},{"action":"Decide report redesign owner","status":"unconfirmed"}],"decisions":[{"decision":"Freeze the event schema on Friday","evidence":"migration script passes on staging"}],"follow_up":"unknown","meeting_conclusion":"The team agreed to freeze the event schema on Friday and postponed the report redesign.","open_questions":["Who owns the legacy dashboard after the freeze?"],"risks_and_dependencies":["Freeze depends on the staging migration result"],"schema_version":"meeting_action_summary_output.v1"}